{
  "version": 2,
  "program": "x402",
  "generated_at": "2026-10-14T12:24:30.117Z",
  "score_spec": "2.0",
  "disclaimer": "x402 Verified by ForgeMesh is an independent ForgeMesh program. It is not an x402 Foundation or Coinbase certification, endorsement, or official program. A listing records checks and a settled payment at a point in time; it is not a warranty or guarantee.",
  "marks": {
    "score": "ForgeMesh Verified Score, 0-100: current technical quality of the x402 implementation.",
    "forgemesh_paid": "$ ForgeMesh Paid: ForgeMesh itself completed and independently verified a real x402 transaction with the seller.",
    "perfect": "★ Perfect: the seller currently scores exactly 100/100.",
    "status": "active | degraded | delisted: current operating health."
  },
  "sellers": [
    {
      "slug": "kushbitx-agentproof",
      "name": "KushBitx AgentProof",
      "homepage": "https://kushbitx.com",
      "description": "Non-custodial x402 v2 verification APIs for AI agents on Base, including deterministic quick checks, token risk, unsigned transaction…",
      "protocols": [
        "x402"
      ],
      "endpoints": [
        {
          "url": "https://kushbitx.com/api/agentproof-quick-check",
          "method": "GET",
          "price_usdc": "0.001"
        }
      ],
      "nominated_endpoint": 0,
      "payTo": "0x0d68028d06af13379C872FEE032568B4Be712f22",
      "networks": [
        "eip155:8453"
      ],
      "networks_detected": [
        "eip155:8453"
      ],
      "score": 100,
      "score_band": "excellent",
      "dimensions": {
        "payability": 40,
        "reliability": 20,
        "interoperability": 20,
        "discoverability": 20
      },
      "score_details": [
        {
          "dimension": "payability",
          "points": 10,
          "max": 10,
          "check": "every declared endpoint answers HTTP 402",
          "ok": true
        },
        {
          "dimension": "payability",
          "points": 10,
          "max": 10,
          "check": "every 402 carries a valid x402 envelope",
          "ok": true
        },
        {
          "dimension": "payability",
          "points": 5,
          "max": 5,
          "check": "envelope payTo matches the declared payTo",
          "ok": true
        },
        {
          "dimension": "payability",
          "points": 15,
          "max": 15,
          "check": "seller-supplied on-chain proof verified",
          "ok": true
        },
        {
          "dimension": "reliability",
          "points": 14,
          "max": 14,
          "check": "2/2 recent probe runs passed",
          "ok": true
        },
        {
          "dimension": "reliability",
          "points": 6,
          "max": 6,
          "check": "latest response 128 ms",
          "ok": true
        },
        {
          "dimension": "interoperability",
          "points": 5,
          "max": 5,
          "check": "envelope declares x402Version 2",
          "ok": true
        },
        {
          "dimension": "interoperability",
          "points": 5,
          "max": 5,
          "check": "envelope delivered in the payment-required header",
          "ok": true
        },
        {
          "dimension": "interoperability",
          "points": 5,
          "max": 5,
          "check": "envelope also present in the JSON body (stock v1 clients)",
          "ok": true
        },
        {
          "dimension": "interoperability",
          "points": 5,
          "max": 5,
          "check": "accepts[] entries well-formed: exact scheme, CAIP-2 network, canonical USDC, amount = declared price",
          "ok": true
        },
        {
          "dimension": "discoverability",
          "points": 6,
          "max": 6,
          "check": "/.well-known/x402 manifest present",
          "ok": true
        },
        {
          "dimension": "discoverability",
          "points": 5,
          "max": 5,
          "check": "manifest names every declared route",
          "ok": true
        },
        {
          "dimension": "discoverability",
          "points": 4,
          "max": 4,
          "check": "llms.txt present",
          "ok": true
        },
        {
          "dimension": "discoverability",
          "points": 5,
          "max": 5,
          "check": "listed in the CDP Bazaar",
          "ok": true
        }
      ],
      "status": "active",
      "perfect": true,
      "forgemesh_paid": false,
      "forgemesh_paid_at": null,
      "forgemesh_paid_tx": null,
      "forgemesh_paid_amount_atomic": null,
      "forgemesh_paid_stale": false,
      "proof": {
        "tx_hash": "0x000dcab74621c9bb075cdb85b062ea331a524cd6e177d2ab748c4607f2d786ac",
        "endpoint": 0,
        "payer_kind": "self"
      },
      "proof_check": {
        "ok": true,
        "reason": null,
        "tx_hash": "0x000dcab74621c9bb075cdb85b062ea331a524cd6e177d2ab748c4607f2d786ac",
        "block": 51827855,
        "block_time": "2026-09-26T17:50:57.000Z",
        "amount_atomic": "2000",
        "payer": "0x18bc8cbd245b72cc382e41fcdc4b34d8237772fd",
        "confirmations": 118922,
        "checked_at": "2026-09-29T11:55:02.392Z"
      },
      "probes": [
        {
          "at": "2026-09-29T11:55:02.113Z",
          "pass": true,
          "is_402": true,
          "envelope_valid": true,
          "payto_match": true,
          "header_envelope": true,
          "body_envelope": true,
          "x402_version_2": true,
          "mpp_header": false,
          "ms": 165,
          "manifest_ok": true,
          "manifest_lists_route": true,
          "llms_ok": true
        },
        {
          "at": "2026-10-07T19:41:08.303Z",
          "pass": true,
          "is_402": true,
          "envelope_valid": true,
          "payto_match": true,
          "header_envelope": true,
          "body_envelope": true,
          "x402_version_2": true,
          "mpp_header": false,
          "ms": 128,
          "manifest_ok": true,
          "manifest_lists_route": true,
          "llms_ok": true
        }
      ],
      "last_probe": "2026-10-07T19:41:08.303Z",
      "bazaar_listed": true,
      "protocol_capabilities": {
        "x402": {
          "supported": true,
          "verified": true,
          "version": 2
        },
        "mpp": {
          "supported": false,
          "verified": false,
          "note": "detected only; MPP Verified by ForgeMesh is a separate future program"
        }
      },
      "contact": "mailto:admin@kushbitx.com",
      "added_at": "2026-09-27",
      "page": "https://forgemesh.io/partners/kushbitx-agentproof",
      "badge": "https://forgemesh.io/badge/x402/kushbitx-agentproof"
    },
    {
      "slug": "pennyapi",
      "name": "PennyAPI",
      "homepage": "https://pennyregwatch.com",
      "description": "Machine-paid web search and agent utilities over x402 v2 on Base USDC.",
      "protocols": [
        "x402"
      ],
      "endpoints": [
        {
          "url": "https://pennyregwatch.com/v1/search",
          "method": "POST",
          "price_usdc": "0.004",
          "body": {
            "query": "latest autonomous agent payment infrastructure",
            "limit": 3
          }
        }
      ],
      "nominated_endpoint": 0,
      "payTo": "0x5deaebaf98034cc0d9abe3757a440b121c42ef0a",
      "networks": [
        "eip155:8453"
      ],
      "networks_detected": [
        "eip155:8453"
      ],
      "score": 100,
      "score_band": "excellent",
      "dimensions": {
        "payability": 40,
        "reliability": 20,
        "interoperability": 20,
        "discoverability": 20
      },
      "score_details": [
        {
          "dimension": "payability",
          "points": 10,
          "max": 10,
          "check": "every declared endpoint answers HTTP 402",
          "ok": true
        },
        {
          "dimension": "payability",
          "points": 10,
          "max": 10,
          "check": "every 402 carries a valid x402 envelope",
          "ok": true
        },
        {
          "dimension": "payability",
          "points": 5,
          "max": 5,
          "check": "envelope payTo matches the declared payTo",
          "ok": true
        },
        {
          "dimension": "payability",
          "points": 15,
          "max": 15,
          "check": "seller-supplied on-chain proof verified",
          "ok": true
        },
        {
          "dimension": "reliability",
          "points": 14,
          "max": 14,
          "check": "2/2 recent probe runs passed",
          "ok": true
        },
        {
          "dimension": "reliability",
          "points": 6,
          "max": 6,
          "check": "latest response 98 ms",
          "ok": true
        },
        {
          "dimension": "interoperability",
          "points": 5,
          "max": 5,
          "check": "envelope declares x402Version 2",
          "ok": true
        },
        {
          "dimension": "interoperability",
          "points": 5,
          "max": 5,
          "check": "envelope delivered in the payment-required header",
          "ok": true
        },
        {
          "dimension": "interoperability",
          "points": 5,
          "max": 5,
          "check": "envelope also present in the JSON body (stock v1 clients)",
          "ok": true
        },
        {
          "dimension": "interoperability",
          "points": 5,
          "max": 5,
          "check": "accepts[] entries well-formed: exact scheme, CAIP-2 network, canonical USDC, amount = declared price",
          "ok": true
        },
        {
          "dimension": "discoverability",
          "points": 6,
          "max": 6,
          "check": "/.well-known/x402 manifest present",
          "ok": true
        },
        {
          "dimension": "discoverability",
          "points": 5,
          "max": 5,
          "check": "manifest names every declared route",
          "ok": true
        },
        {